{
  "agent": "joab",
  "team": "mishmar",
  "sprint": "S2",
  "trigger": "requested",
  "query_intent": "Whether VendorX OAuth2 honours PKCE S256 in production, since public docs describe staging only.",
  "tools_invoked": ["jakin", "ezra", "caleb", "shaphan", "shemaiah", "baruch"],
  "research_output_summary": "VendorX public OAuth2 docs describe staging behaviour and state production may differ. No authoritative source for production PKCE handling found; community reports conflict. Confidence: low. Cannot resolve without vendor confirmation.",
  "applied_to_task": "T-24",
  "outcome": "blocked",
  "knowledge_graph_write": false,
  "curated_library_match": false,
  "cognee_node_id": null,
  "timestamp": "2026-06-02T14:10:00Z"
}
